{
  "$schema": "https://jounirautio78-ops.github.io/pixan-global-market-evidence-public/schemas/investor-disclosure-control.schema.json",
  "schemaVersion": "1.0",
  "controlId": "pixan-investor-disclosure-control-2026-07-28",
  "asOf": "2026-08-03",
  "controlState": "fail_closed",
  "languages": [
    "en",
    "fi"
  ],
  "publicBoundary": {
    "statementEn": "Independent public evidence summary. It is not Pixan Oy's official position and is not an audit, valuation, legal opinion, investment recommendation or lending recommendation.",
    "statementFi": "Riippumaton julkinen evidenssikooste. Se ei ole Pixan Oy:n virallinen kanta eikä tilintarkastus, arvonmääritys, oikeudellinen lausunto, sijoitussuositus tai lainasuositus.",
    "defaultTier": "public",
    "deeperAccessIsNotGrantedByThisControl": true,
    "failClosedRuleEn": "If classification, provenance, licence, privilege, privacy, authority or recipient scope is missing or uncertain, do not disclose beyond the public tier.",
    "failClosedRuleFi": "Jos luokitus, alkuperä, lisenssi, salassapitoetu, tietosuoja, toimivalta tai vastaanottajajoukko puuttuu tai on epävarma, aineistoa ei luovuteta julkista tasoa syvemmälle."
  },
  "audiences": [
    {
      "audienceId": "lender",
      "titleEn": "Lender",
      "titleFi": "Lainanantaja",
      "legitimateUseEn": "Initial credit, collateral and diligence screening using current published evidence.",
      "legitimateUseFi": "Luotto-, vakuus- ja due diligence -alkuarvio käyttäen ajantasaista julkaistua evidenssiä.",
      "defaultTier": "public",
      "potentialDeeperTiers": [
        "nda",
        "restricted_clean_team_counsel",
        "board_counsel"
      ],
      "constraintEn": "Access may expand only to information necessary for an identified credit decision after every applicable gate passes; this control grants no access.",
      "constraintFi": "Pääsy voi laajentua vain yksilöityyn luottopäätökseen tarpeelliseen aineistoon kaikkien soveltuvien porttien läpäisyn jälkeen; tämä kontrolli ei myönnä pääsyä."
    },
    {
      "audienceId": "strategic_buyer",
      "titleEn": "Strategic buyer",
      "titleFi": "Strateginen ostaja",
      "legitimateUseEn": "Initial acquisition screening and structured confirmatory diligence.",
      "legitimateUseFi": "Yritysoston alkuarvio ja jäsennelty vahvistava due diligence.",
      "defaultTier": "public",
      "potentialDeeperTiers": [
        "nda",
        "restricted_clean_team_counsel",
        "board_counsel"
      ],
      "constraintEn": "Competition-sensitive or dispute-sensitive information requires counsel-led clean-team controls and need-to-know access.",
      "constraintFi": "Kilpailu- tai riita-arkaluonteinen aineisto edellyttää oikeudellisen neuvonantajan johtamaa clean team -kontrollia ja need-to-know-pääsyä."
    },
    {
      "audienceId": "litigation_funder",
      "titleEn": "Litigation funder",
      "titleFi": "Oikeudenkäyntirahoittaja",
      "legitimateUseEn": "Initial screening of the published patent, evidence and proceeding record before counsel-controlled diligence.",
      "legitimateUseFi": "Julkaistun patentti-, evidenssi- ja menettelyaineiston alkuarvio ennen oikeudellisen neuvonantajan kontrolloimaa tarkastusta.",
      "defaultTier": "public",
      "potentialDeeperTiers": [
        "nda",
        "restricted_clean_team_counsel",
        "board_counsel"
      ],
      "constraintEn": "Privilege, work-product protection, litigation-control rights and permitted use must be decided by counsel before any deeper disclosure.",
      "constraintFi": "Salassapitoetu, work product -suoja, oikeudenkäynnin määräysvalta ja sallittu käyttö on ratkaistava oikeudellisen neuvonantajan toimesta ennen syvempää luovutusta."
    },
    {
      "audienceId": "adviser",
      "titleEn": "Adviser",
      "titleFi": "Neuvonantaja",
      "legitimateUseEn": "Professional review within a documented mandate for a lender, buyer, funder or the rights holder.",
      "legitimateUseFi": "Ammatillinen tarkastus dokumentoidun toimeksiannon rajoissa lainanantajalle, ostajalle, rahoittajalle tai oikeudenhaltijalle.",
      "defaultTier": "public",
      "potentialDeeperTiers": [
        "nda",
        "restricted_clean_team_counsel",
        "board_counsel"
      ],
      "constraintEn": "An adviser receives no broader rights than the appointing principal and must be named, bound and technically restricted.",
      "constraintFi": "Neuvonantaja ei saa toimeksiantajaansa laajempia oikeuksia, ja hänen on oltava nimetty, sitoutettu ja teknisesti rajattu."
    }
  ],
  "accessTiers": [
    {
      "tierId": "public",
      "order": 1,
      "titleEn": "Public",
      "titleFi": "Julkinen",
      "purposeEn": "Initial screening through the reviewed public site, downloadable lender package and source-linked structured data.",
      "purposeFi": "Alkuarvio tarkistetun julkisen sivuston, ladattavan rahoittajapaketin ja lähteistetyn rakenteisen datan avulla.",
      "permittedContentEn": "Only assets expressly mapped to the public tier below, with their published qualifications, dates, methods and uncertainty labels intact.",
      "permittedContentFi": "Vain alla julkiselle tasolle nimenomaisesti kartoitetut aineistot julkaistuine rajauksineen, päivämäärineen, menetelmineen ja epävarmuusmerkintöineen.",
      "excludedContentEn": "All prohibited-public categories and every item not expressly allowlisted.",
      "excludedContentFi": "Kaikki julkisesti kielletyt aineistoluokat ja kaikki, mitä ei ole nimenomaisesti sallittu.",
      "releaseRuleEn": "No access decision is required for the already published assets; republication must preserve context, attribution and limitations.",
      "releaseRuleFi": "Jo julkaistuihin aineistoihin ei tarvita erillistä pääsypäätöstä; uudelleenjulkaisussa on säilytettävä asiayhteys, lähdeviittaus ja rajaukset.",
      "sensitiveMaterialEmbeddedInThisControl": false
    },
    {
      "tierId": "nda",
      "order": 2,
      "titleEn": "NDA diligence",
      "titleFi": "NDA-tarkastus",
      "purposeEn": "Counterparty-specific confirmatory diligence after identity, purpose, NDA, rights and disclosure scope are approved.",
      "purposeFi": "Vastapuolikohtainen vahvistava tarkastus henkilöllisyyden, tarkoituksen, NDA:n, oikeuksien ja luovutusrajan hyväksymisen jälkeen.",
      "permittedContentEn": "Only separately approved, source-traceable and rights-cleared diligence summaries necessary for the documented purpose.",
      "permittedContentFi": "Vain erikseen hyväksytyt, lähteisiin jäljitettävät ja käyttöoikeuksiltaan selvitetyt tarkastustiivistelmät, jotka ovat dokumentoituun tarkoitukseen tarpeellisia.",
      "excludedContentEn": "No privileged advice, unredacted personal data, unrestricted correspondence, negotiation parameters or vendor material without express onward-disclosure rights.",
      "excludedContentFi": "Ei salassapitoedun alaista neuvontaa, peittämättömiä henkilötietoja, rajaamatonta kirjeenvaihtoa, neuvotteluparametreja tai toimittaja-aineistoa ilman nimenomaista edelleenluovutusoikeutta.",
      "releaseRuleEn": "Every applicable hard gate must pass for the named recipients; access is time-limited, logged and revocable.",
      "releaseRuleFi": "Jokaisen soveltuvan kovan portin on läpäistävä nimettyjen vastaanottajien osalta; pääsy on määräaikainen, lokitettu ja peruutettavissa.",
      "sensitiveMaterialEmbeddedInThisControl": false
    },
    {
      "tierId": "restricted_clean_team_counsel",
      "order": 3,
      "titleEn": "Restricted clean team / counsel",
      "titleFi": "Rajoitettu clean team / oikeudellinen neuvonantaja",
      "purposeEn": "Need-to-know review of separately stored competition-sensitive, dispute-sensitive or licence-restricted diligence under counsel control.",
      "purposeFi": "Erikseen säilytetyn kilpailu-, riita- tai lisenssiarkaluonteisen tarkastusaineiston need-to-know-käsittely oikeudellisen neuvonantajan kontrollissa.",
      "permittedContentEn": "Only counsel-approved extracts or summaries whose recipient, purpose, licence, privilege and competition-law conditions are documented.",
      "permittedContentFi": "Vain oikeudellisen neuvonantajan hyväksymät otteet tai tiivistelmät, joiden vastaanottaja-, tarkoitus-, lisenssi-, salassapitoetu- ja kilpailuoikeusehdot on dokumentoitu.",
      "excludedContentEn": "No uncontrolled export, copying, onward sharing or commingling with the public evidence repository.",
      "excludedContentFi": "Ei hallitsematonta vientiä, kopiointia, edelleenjakamista tai yhdistämistä julkiseen evidenssirepositorioon.",
      "releaseRuleEn": "Counsel must approve the clean-team perimeter, permitted fields, access period, logging, export controls and destruction or return plan.",
      "releaseRuleFi": "Oikeudellisen neuvonantajan on hyväksyttävä clean team -raja, sallitut kentät, pääsyaika, lokitus, vientirajoitukset sekä hävitys- tai palautussuunnitelma.",
      "sensitiveMaterialEmbeddedInThisControl": false
    },
    {
      "tierId": "board_counsel",
      "order": 4,
      "titleEn": "Board + counsel",
      "titleFi": "Hallitus + oikeudellinen neuvonantaja",
      "purposeEn": "Governance decisions and final legal or transaction authority in a separately controlled environment.",
      "purposeFi": "Hallinnolliset päätökset ja lopullinen oikeudellinen tai transaktiotoimivalta erikseen kontrolloidussa ympäristössä.",
      "permittedContentEn": "Only material separately assembled for a documented board or counsel decision after all lower-tier controls and the final authority gate pass.",
      "permittedContentFi": "Vain dokumentoitua hallituksen tai oikeudellisen neuvonantajan päätöstä varten erikseen koottu aineisto kaikkien alempien tasojen kontrollien ja lopullisen toimivaltaportin läpäisyn jälkeen.",